{
  "name": "retrieval-evals",
  "version": "1.0.0",
  "status": "beta",
  "owner": "platform-team",
  "description": "Retrieval evaluation and benchmarking for RAG",
  "requiresAuth": true,
  "supportsJobs": false,
  "testLevel": "unit",
  "dependencies": ["rag", "rag-ingestion"],
  "envVars": [
    {
      "name": "RETRIEVAL_EVAL_OUTPUT_DIR",
      "required": false,
      "description": "Output directory for evaluation results (default: ./cache/retrieval-evals)"
    }
  ]
}
